[{"id":"youtube-music","name":"YouTube Music","domain":"music.youtube.com","category":"music","targetRegions":["GLOBAL"],"reviewStatus":"candidate","notes":null},{"id":"amazon-music","name":"Amazon Music","domain":"music.amazon.com","category":"music","targetRegions":["GLOBAL"],"reviewStatus":"candidate","notes":null},{"id":"deezer","name":"Deezer","domain":"deezer.com","category":"music","targetRegions":["GLOBAL"],"reviewStatus":"candidate","notes":null},{"id":"tidal","name":"TIDAL","domain":"tidal.com","category":"music","targetRegions":["GLOBAL"],"reviewStatus":"candidate","notes":null},{"id":"qobuz","name":"Qobuz","domain":"qobuz.com","category":"music","targetRegions":["GLOBAL"],"reviewStatus":"candidate","notes":null},{"id":"soundcloud-go","name":"SoundCloud Go+","domain":"soundcloud.com","category":"music","targetRegions":["GLOBAL"],"reviewStatus":"candidate","notes":null},{"id":"pandora","name":"Pandora","domain":"pandora.com","category":"music","targetRegions":["GLOBAL"],"reviewStatus":"candidate","notes":null},{"id":"iheartradio-plus","name":"iHeartRadio Plus","domain":"iheart.com","category":"music","targetRegions":["GLOBAL"],"reviewStatus":"candidate","notes":null},{"id":"audible","name":"Audible","domain":"audible.com","category":"education","targetRegions":["GLOBAL"],"reviewStatus":"candidate","notes":null},{"id":"kindle-unlimited","name":"Kindle Unlimited","domain":"amazon.com","category":"education","targetRegions":["GLOBAL"],"reviewStatus":"candidate","notes":null},{"id":"everand","name":"Everand","domain":"everand.com","category":"education","targetRegions":["GLOBAL"],"reviewStatus":"candidate","notes":null},{"id":"new-york-times","name":"The New York Times","domain":"nytimes.com","category":"news","targetRegions":["GLOBAL"],"reviewStatus":"candidate","notes":null},{"id":"washington-post","name":"The Washington Post","domain":"washingtonpost.com","category":"news","targetRegions":["GLOBAL"],"reviewStatus":"candidate","notes":null},{"id":"wall-street-journal","name":"The Wall Street Journal","domain":"wsj.com","category":"news","targetRegions":["GLOBAL"],"reviewStatus":"candidate","notes":null},{"id":"financial-times","name":"Financial Times","domain":"ft.com","category":"news","targetRegions":["GLOBAL"],"reviewStatus":"candidate","notes":null},{"id":"the-economist","name":"The Economist","domain":"economist.com","category":"news","targetRegions":["GLOBAL"],"reviewStatus":"candidate","notes":null},{"id":"the-atlantic","name":"The Atlantic","domain":"theatlantic.com","category":"news","targetRegions":["GLOBAL"],"reviewStatus":"candidate","notes":null},{"id":"new-yorker","name":"The New Yorker","domain":"newyorker.com","category":"news","targetRegions":["GLOBAL"],"reviewStatus":"candidate","notes":null},{"id":"bloomberg","name":"Bloomberg","domain":"bloomberg.com","category":"news","targetRegions":["GLOBAL"],"reviewStatus":"candidate","notes":null},{"id":"business-insider","name":"Business Insider","domain":"businessinsider.com","category":"news","targetRegions":["GLOBAL"],"reviewStatus":"candidate","notes":null},{"id":"medium","name":"Medium","domain":"medium.com","category":"news","targetRegions":["GLOBAL"],"reviewStatus":"candidate","notes":null},{"id":"substack","name":"Substack","domain":"substack.com","category":"news","targetRegions":["GLOBAL"],"reviewStatus":"candidate","notes":null},{"id":"readwise-reader","name":"Readwise Reader","domain":"readwise.io","category":"productivity","targetRegions":["GLOBAL"],"reviewStatus":"candidate","notes":null},{"id":"feedly-pro","name":"Feedly Pro","domain":"feedly.com","category":"productivity","targetRegions":["GLOBAL"],"reviewStatus":"candidate","notes":null},{"id":"pocket-premium","name":"Pocket Premium","domain":"getpocket.com","category":"productivity","targetRegions":["GLOBAL"],"reviewStatus":"candidate","notes":null},{"id":"ground-news","name":"Ground News","domain":"ground.news","category":"news","targetRegions":["GLOBAL"],"reviewStatus":"candidate","notes":null},{"id":"apple-news-plus","name":"Apple News+","domain":"apple.com","category":"news","targetRegions":["GLOBAL"],"reviewStatus":"candidate","notes":null},{"id":"pressreader","name":"PressReader","domain":"pressreader.com","category":"news","targetRegions":["GLOBAL"],"reviewStatus":"candidate","notes":null},{"id":"magzter","name":"Magzter","domain":"magzter.com","category":"news","targetRegions":["GLOBAL"],"reviewStatus":"candidate","notes":null},{"id":"blinkist","name":"Blinkist","domain":"blinkist.com","category":"education","targetRegions":["GLOBAL"],"reviewStatus":"candidate","notes":null},{"id":"xbox-game-pass","name":"Xbox Game Pass","domain":"xbox.com","category":"gaming","targetRegions":["GLOBAL"],"reviewStatus":"candidate","notes":null},{"id":"playstation-plus","name":"PlayStation Plus","domain":"playstation.com","category":"gaming","targetRegions":["GLOBAL"],"reviewStatus":"candidate","notes":null},{"id":"nintendo-switch-online","name":"Nintendo Switch Online","domain":"nintendo.com","category":"gaming","targetRegions":["GLOBAL"],"reviewStatus":"candidate","notes":null},{"id":"ea-play","name":"EA Play","domain":"ea.com","category":"gaming","targetRegions":["GLOBAL"],"reviewStatus":"candidate","notes":null},{"id":"ubisoft-plus","name":"Ubisoft+","domain":"ubisoft.com","category":"gaming","targetRegions":["GLOBAL"],"reviewStatus":"candidate","notes":null},{"id":"geforce-now","name":"GeForce NOW","domain":"nvidia.com","category":"gaming","targetRegions":["GLOBAL"],"reviewStatus":"candidate","notes":null},{"id":"amazon-luna","name":"Amazon Luna","domain":"amazon.com","category":"gaming","targetRegions":["GLOBAL"],"reviewStatus":"candidate","notes":null},{"id":"apple-arcade","name":"Apple Arcade","domain":"apple.com","category":"gaming","targetRegions":["GLOBAL"],"reviewStatus":"candidate","notes":null},{"id":"google-play-pass","name":"Google Play Pass","domain":"play.google.com","category":"gaming","targetRegions":["GLOBAL"],"reviewStatus":"candidate","notes":null},{"id":"discord-nitro","name":"Discord Nitro","domain":"discord.com","category":"gaming","targetRegions":["GLOBAL"],"reviewStatus":"candidate","notes":null},{"id":"twitch-turbo","name":"Twitch Turbo","domain":"twitch.tv","category":"gaming","targetRegions":["GLOBAL"],"reviewStatus":"candidate","notes":null},{"id":"humble-choice","name":"Humble Choice","domain":"humblebundle.com","category":"gaming","targetRegions":["GLOBAL"],"reviewStatus":"candidate","notes":null},{"id":"crunchyroll-game-vault","name":"Crunchyroll Game Vault","domain":"crunchyroll.com","category":"gaming","targetRegions":["GLOBAL"],"reviewStatus":"candidate","notes":null},{"id":"final-fantasy-xiv","name":"Final Fantasy XIV","domain":"finalfantasyxiv.com","category":"gaming","targetRegions":["GLOBAL"],"reviewStatus":"candidate","notes":null},{"id":"world-of-warcraft","name":"World of Warcraft","domain":"worldofwarcraft.com","category":"gaming","targetRegions":["GLOBAL"],"reviewStatus":"candidate","notes":null},{"id":"runescape-membership","name":"RuneScape Membership","domain":"runescape.com","category":"gaming","targetRegions":["GLOBAL"],"reviewStatus":"candidate","notes":null},{"id":"elder-scrolls-online-plus","name":"ESO Plus","domain":"elderscrollsonline.com","category":"gaming","targetRegions":["GLOBAL"],"reviewStatus":"candidate","notes":null},{"id":"fallout-1st","name":"Fallout 1st","domain":"fallout.com","category":"gaming","targetRegions":["GLOBAL"],"reviewStatus":"candidate","notes":null},{"id":"gta-plus","name":"GTA+","domain":"rockstargames.com","category":"gaming","targetRegions":["GLOBAL"],"reviewStatus":"candidate","notes":null},{"id":"fortnite-crew","name":"Fortnite Crew","domain":"fortnite.com","category":"gaming","targetRegions":["GLOBAL"],"reviewStatus":"candidate","notes":null},{"id":"minecraft-realms","name":"Minecraft Realms","domain":"minecraft.net","category":"gaming","targetRegions":["GLOBAL"],"reviewStatus":"candidate","notes":null},{"id":"roblox-premium","name":"Roblox Premium","domain":"roblox.com","category":"gaming","targetRegions":["GLOBAL"],"reviewStatus":"candidate","notes":null},{"id":"pokemon-home","name":"Pokémon HOME","domain":"pokemon.com","category":"gaming","targetRegions":["GLOBAL"],"reviewStatus":"candidate","notes":null},{"id":"chess-com","name":"Chess.com","domain":"chess.com","category":"gaming","targetRegions":["GLOBAL"],"reviewStatus":"candidate","notes":null},{"id":"lichess-patron","name":"Lichess Patron","domain":"lichess.org","category":"gaming","targetRegions":["GLOBAL"],"reviewStatus":"candidate","notes":null},{"id":"1password","name":"1Password","domain":"1password.com","category":"security","targetRegions":["GLOBAL"],"reviewStatus":"candidate","notes":null},{"id":"bitwarden","name":"Bitwarden","domain":"bitwarden.com","category":"security","targetRegions":["GLOBAL"],"reviewStatus":"candidate","notes":null},{"id":"dashlane","name":"Dashlane","domain":"dashlane.com","category":"security","targetRegions":["GLOBAL"],"reviewStatus":"candidate","notes":null},{"id":"lastpass","name":"LastPass","domain":"lastpass.com","category":"security","targetRegions":["GLOBAL"],"reviewStatus":"candidate","notes":null},{"id":"nordvpn","name":"NordVPN","domain":"nordvpn.com","category":"security","targetRegions":["GLOBAL"],"reviewStatus":"candidate","notes":null},{"id":"expressvpn","name":"ExpressVPN","domain":"expressvpn.com","category":"security","targetRegions":["GLOBAL"],"reviewStatus":"candidate","notes":null},{"id":"surfshark","name":"Surfshark","domain":"surfshark.com","category":"security","targetRegions":["GLOBAL"],"reviewStatus":"candidate","notes":null},{"id":"proton-vpn","name":"Proton VPN","domain":"protonvpn.com","category":"security","targetRegions":["GLOBAL"],"reviewStatus":"candidate","notes":null},{"id":"mullvad-vpn","name":"Mullvad VPN","domain":"mullvad.net","category":"security","targetRegions":["GLOBAL"],"reviewStatus":"candidate","notes":null},{"id":"cyberghost","name":"CyberGhost","domain":"cybergh